{"name":"python-interactive-dashboard","version":"1.0.0","shape":"interactive-dashboard","runtime":"Python 3.9 standard library local scaffold","allowed_capabilities":["validated-read","server-rendered-view","health-endpoint"],"required_controls":["CF-A01","CF-A03","CF-A05","CF-B14","CF-B17","CF-B18","CF-C23","CF-C25","CF-C29","CF-D34"],"scaffold_files":["src/app.py","tests/test_smoke.py","pyproject.toml","requirements.lock"],"production_adapters":["identity","database","cloud-runtime","observability","backup"]}
