{"name":"python-workflow-automation","version":"1.0.0","shape":"workflow-automation","runtime":"Python 3.9 standard library","allowed_capabilities":["local-file-read","bounded-local-write","human-confirmed-action"],"required_controls":["CF-A01","CF-A03","CF-A06","CF-A07","CF-B15","CF-B16","CF-B17","CF-B20","CF-C23","CF-C30"],"scaffold_files":["src/app.py","tests/test_smoke.py","pyproject.toml","requirements.lock"],"production_adapters":["approval"]}
