{"name":"python-internal-crud","version":"1.0.0","shape":"crud-internal-app","runtime":"Python 3.9 standard library local scaffold","allowed_capabilities":["validated-input","transactional-local-storage","audit-log"],"required_controls":["CF-A01","CF-A03","CF-A07","CF-B15","CF-B16","CF-B17","CF-B18","CF-B19","CF-B20","CF-B22","CF-C23","CF-C32"],"scaffold_files":["src/app.py","tests/test_smoke.py","pyproject.toml","requirements.lock"],"production_adapters":["identity","database","backup","observability"]}
