{"name":"python-artifact-generator","version":"1.0.0","shape":"artifact-generator","runtime":"Python 3.9 standard library","allowed_capabilities":["local-file-read","local-artifact-write"],"required_controls":["CF-A01","CF-A03","CF-A06","CF-B09","CF-B10","CF-B14","CF-B15","CF-C23","CF-C25"],"scaffold_files":["src/app.py","tests/test_smoke.py","pyproject.toml","requirements.lock"],"production_adapters":[]}
